{
  "formatId": "report-writing.default",
  "displayName": "Luận văn (VN academic thesis)",
  "phaseId": "report-writing",
  "version": "v1",
  "templateFile": "template.dotx",
  "page": {
    "size": "letter",
    "widthTwips": 12240,
    "heightTwips": 15840,
    "orientation": "portrait",
    "margins": { "topTwips": 1987, "rightTwips": 1134, "bottomTwips": 1699, "leftTwips": 1985 }
  },
  "typography": {
    "defaultFont": "Times New Roman",
    "defaultSizePt": 13,
    "defaultLineSpacing": "1.5",
    "defaultAlignment": "justify"
  },
  "headings": {
    "1": { "wordStyle": "Heading1", "font": "Times New Roman", "sizePt": 13, "bold": true, "align": "center" },
    "2": { "wordStyle": "Heading2", "font": "Times New Roman", "sizePt": 13, "bold": true },
    "3": { "wordStyle": "Heading3", "font": "Times New Roman", "sizePt": 13, "bold": true, "align": "justify" }
  },
  "caption": { "wordStyle": "Caption" },
  "reference": { "wordStyle": "Bibliography" },
  "table": { "wordStyle": "TableGrid" },
  "styleMap": {
    "paragraph": "Normal",
    "reference": "Bibliography",
    "tocHeading": "TOCHeading",
    "toc:1": "TOC1",
    "toc:2": "TOC2",
    "toc:3": "TOC3"
  },
  "toc": { "enabled": true, "depth": 3, "autoGenerateFromHeadings": true },
  "headingNumbering": { "auto": false },
  "citationStyle": "vancouver",
  "pageNumbering": "arabic",
  "sharedFormattingWith": "protocol-design.default",
  "formatFamily": "vn-academic-thesis",
  "familyRole": "full-thesis-writeup",
  "diffFromFamilyBase": "Chapter III is real Results (not Expected Results) and Chapter IV is Discussion (not Implementation Plan) — see document-skeleton.json. Page/typography/named styles are identical to protocol-design.default; see GENERAL_VS_PRIVATE_NOTES.md."
}
