{
  "formatId": "journal-submission.ieee",
  "displayName": "IEEE Transactions manuscript",
  "phaseId": "journal-submission",
  "version": "v1",
  "templateFile": "template.dotx",
  "page": {
    "size": "letter",
    "widthTwips": 12240,
    "heightTwips": 15840,
    "orientation": "portrait",
    "margins": {
      "topTwips": 1440,
      "rightTwips": 1440,
      "bottomTwips": 1440,
      "leftTwips": 1440
    }
  },
  "typography": {
    "defaultFont": "Times New Roman",
    "defaultSizePt": 10,
    "defaultLineSpacing": "single",
    "defaultAlignment": "justify",
    "language": null
  },
  "headings": {
    "1": {
      "wordStyle": "IEEE Heading 1"
    },
    "2": {
      "wordStyle": "IEEE Heading 2"
    },
    "3": {
      "wordStyle": "IEEE Heading 3"
    },
    "4": {
      "wordStyle": "IEEE Heading 4"
    },
    "5": {
      "wordStyle": "IEEE Heading 5"
    },
    "6": {
      "wordStyle": "IEEE Heading 6"
    }
  },
  "styleMap": {
    "title": "IEEE Paper Title",
    "subtitle": "IEEE Author Block",
    "paragraph": "IEEE Body",
    "list:bullet": "IEEE Bullet",
    "list:ordered": "IEEE Numbered",
    "table": "IEEE Table",
    "tableHeader": "IEEE Table Head",
    "figure": "IEEE Figure",
    "caption": "IEEE Caption",
    "blockquote": "IEEE Quote",
    "codeBlock": "IEEE Code",
    "toc:1": "IEEE Contents Entry",
    "toc:2": "IEEE Contents Entry",
    "toc:3": "IEEE Contents Entry",
    "footnote": "IEEE Footnote"
  },
  "toc": {
    "enabled": false,
    "depth": 0,
    "autoGenerateFromHeadings": true
  },
  "headingNumbering": {
    "auto": false,
    "note": "Headings use direct Word styles only; no automatic multilevel numbering is linked to them."
  },
  "citationStyle": "ieee",
  "pageNumbering": "arabic",
  "docFeatures": {
    "coverPage": false
  }
}
