{
  "formatId": "defense-report.default",
  "displayName": "Báo cáo bảo vệ luận văn (Thesis defense report)",
  "phaseId": "defense-report",
  "version": "v1",
  "templateFile": "template.dotx",
  "page": {
    "size": "letter",
    "widthTwips": 12240,
    "heightTwips": 15840,
    "orientation": "portrait",
    "margins": { "topTwips": 1987, "rightTwips": 1134, "bottomTwips": 1699, "leftTwips": 1985 }
  },
  "typography": {
    "defaultFont": "Times New Roman",
    "defaultSizePt": 13,
    "defaultLineSpacing": "1.5",
    "defaultAlignment": "justify"
  },
  "headings": {
    "1": { "wordStyle": "Heading1", "font": "Times New Roman", "sizePt": 13, "bold": true, "align": "center" },
    "2": { "wordStyle": "Heading2", "font": "Times New Roman", "sizePt": 13, "bold": true }
  },
  "table": { "wordStyle": "TableGrid" },
  "styleMap": {
    "paragraph": "Normal",
    "custom:titleBlockField": { "style": "Normal", "runFormatting": {}, "paragraphFormatting": { "alignment": "center" } },
    "custom:crfHeaderField": { "style": "Normal", "runFormatting": { "bold": true }, "paragraphFormatting": { "alignment": "left" } },
    "custom:closingRemark": { "style": "Normal", "runFormatting": { "bold": true }, "paragraphFormatting": { "alignment": "center" } }
  },
  "toc": { "enabled": false, "depth": 0, "autoGenerateFromHeadings": false },
  "headingNumbering": { "auto": false },
  "citationStyle": "none",
  "pageNumbering": "arabic",
  "reusabilityNote": "Phase_6.pdf is a defense presentation exported to PDF (numbered slides, bullet points) — it carries real section structure and real content, but no OOXML styles to extract font/margin facts from. Styling here is a disclosed assumption, reusing the same verified institutional convention as protocol-design.default/report-writing.default (same overall academic package). Not independently verified against a real Word template for this specific artifact; confirm before publishing."
}
