{
  "formatId": "journal-submission.elsevier",
  "displayName": "Elsevier generic manuscript",
  "phaseId": "journal-submission",
  "version": "v1",
  "templateFile": "template.dotx",
  "page": {
    "size": "letter",
    "widthTwips": 12240,
    "heightTwips": 15840,
    "orientation": "portrait",
    "margins": {
      "topTwips": 1440,
      "rightTwips": 1440,
      "bottomTwips": 1440,
      "leftTwips": 1440
    }
  },
  "typography": {
    "defaultFont": "Times New Roman",
    "defaultSizePt": 12,
    "defaultLineSpacing": "double",
    "defaultAlignment": "left",
    "language": null
  },
  "headings": {
    "1": {
      "wordStyle": "Elsevier Heading 1"
    },
    "2": {
      "wordStyle": "Elsevier Heading 2"
    },
    "3": {
      "wordStyle": "Elsevier Heading 3"
    },
    "4": {
      "wordStyle": "Elsevier Heading 4"
    },
    "5": {
      "wordStyle": "Elsevier Heading 5"
    },
    "6": {
      "wordStyle": "Elsevier Heading 6"
    }
  },
  "styleMap": {
    "title": "Elsevier Title",
    "subtitle": "Elsevier Authors",
    "paragraph": "Elsevier Body",
    "list:bullet": "Elsevier Bullet",
    "list:ordered": "Elsevier Numbered",
    "table": "Elsevier Table",
    "tableHeader": "Elsevier Table Header",
    "figure": "Elsevier Figure",
    "caption": "Elsevier Caption",
    "blockquote": "Elsevier Quote",
    "codeBlock": "Elsevier Code",
    "toc:1": "Elsevier Contents Entry",
    "toc:2": "Elsevier Contents Entry",
    "toc:3": "Elsevier Contents Entry",
    "footnote": "Elsevier Footnote"
  },
  "toc": {
    "enabled": false,
    "depth": 0,
    "autoGenerateFromHeadings": true
  },
  "headingNumbering": {
    "auto": false,
    "note": "Headings use direct Word styles only; no automatic multilevel numbering is linked to them."
  },
  "citationStyle": "harvard",
  "pageNumbering": "arabic",
  "docFeatures": {
    "coverPage": true
  }
}
