{
  "formatId": "report-writing.strobe",
  "displayName": "STROBE (observational studies)",
  "phaseId": "report-writing",
  "version": "v1",
  "templateFile": "template.dotx",
  "page": {
    "size": "letter",
    "widthTwips": 12240,
    "heightTwips": 15840,
    "orientation": "portrait",
    "margins": {
      "topTwips": 1440,
      "rightTwips": 1440,
      "bottomTwips": 1440,
      "leftTwips": 1440
    }
  },
  "typography": {
    "defaultFont": "Times New Roman",
    "defaultSizePt": 12,
    "defaultLineSpacing": "double",
    "defaultAlignment": "left",
    "language": null
  },
  "headings": {
    "1": {
      "wordStyle": "STROBE Heading 1"
    },
    "2": {
      "wordStyle": "STROBE Heading 2"
    },
    "3": {
      "wordStyle": "STROBE Heading 3"
    },
    "4": {
      "wordStyle": "STROBE Heading 4"
    },
    "5": {
      "wordStyle": "STROBE Heading 5"
    },
    "6": {
      "wordStyle": "STROBE Heading 6"
    }
  },
  "styleMap": {
    "title": "STROBE Title",
    "subtitle": "STROBE Subtitle",
    "paragraph": "STROBE Body",
    "list:bullet": "STROBE Bullet",
    "list:ordered": "STROBE Numbered",
    "table": "STROBE Table",
    "tableHeader": "STROBE Table Header",
    "figure": "STROBE Figure",
    "caption": "STROBE Caption",
    "checklistItem": "STROBE Checklist Item",
    "blockquote": "STROBE Quote",
    "codeBlock": "STROBE Code",
    "toc:1": "STROBE Contents Entry",
    "toc:2": "STROBE Contents Entry",
    "toc:3": "STROBE Contents Entry",
    "footnote": "STROBE Footnote"
  },
  "toc": {
    "enabled": true,
    "depth": 2,
    "autoGenerateFromHeadings": true
  },
  "headingNumbering": {
    "auto": false,
    "note": "Headings use direct Word styles only; no automatic multilevel numbering is linked to them."
  },
  "citationStyle": "vancouver",
  "pageNumbering": "arabic",
  "docFeatures": {
    "coverPage": false
  }
}
